{"$id":"urn:mcpaudit:evidence-conservation:FixtureAdmissibilityV1","$schema":"https://json-schema.org/draft/2020-12/schema","additionalProperties":false,"properties":{"admission_status":{"enum":["CANDIDATE","ADMITTED","REJECTED"]},"body":{"additionalProperties":false,"properties":{"artifacts":{"items":{"additionalProperties":false,"properties":{"bytes":{"minimum":1,"type":"integer"},"media_type":{"const":"application/json"},"ref":{"minLength":1,"type":"string"},"sha256":{"pattern":"^[0-9a-f]{64}$","type":"string"}},"required":["ref","media_type","bytes","sha256"],"type":"object"},"minItems":1,"type":"array"},"case_id":{"minLength":1,"type":"string"},"contamination":{"additionalProperties":false,"properties":{"mutation_label_visible":{"const":false},"opaque_names":{"const":true},"oracle_fields_visible":{"const":false}},"required":["opaque_names","oracle_fields_visible","mutation_label_visible"],"type":"object"},"control_case_id":{"minLength":1,"type":"string"},"family_id":{"minLength":1,"type":"string"},"fixture_kind":{"enum":["CONTROL","MUTATION"]},"generator":{"additionalProperties":false,"properties":{"config_sha256":{"pattern":"^[0-9a-f]{64}$","type":"string"},"repository":{"minLength":1,"type":"string"},"revision":{"minLength":1,"type":"string"}},"required":["repository","revision","config_sha256"],"type":"object"},"mutation_locality":{"additionalProperties":false,"properties":{"after_vector":{"items":{"enum":[0,1]},"maxItems":6,"minItems":6,"type":"array"},"axis":{"enum":["CONTROL","MISSING","STALE","MASKED","CONTRADICTORY","UNSUPPORTED","MISBOUND"]},"before_vector":{"items":{"enum":[0,1]},"maxItems":6,"minItems":6,"type":"array"},"changed_fields":{"items":{"minLength":1,"type":"string"},"type":"array"},"favourability_payload_unchanged":{"type":"boolean"},"parent_sha256":{"pattern":"^[0-9a-f]{64}$","type":"string"}},"required":["axis","parent_sha256","changed_fields","before_vector","after_vector","favourability_payload_unchanged"],"type":"object"},"path_id":{"enum":["P1","P2","P3"]},"privacy":{"additionalProperties":false,"properties":{"real_data_present":{"const":false},"reserved_identities_only":{"const":true},"synthetic_only":{"const":true}},"required":["synthetic_only","reserved_identities_only","real_data_present"],"type":"object"},"provenance":{"additionalProperties":false,"properties":{"derivation":{"minLength":1,"type":"string"},"license":{"const":"CC0-1.0"},"source_class":{"const":"SYNTHETIC_FROM_FIRST_PRINCIPLES"},"source_ref":{"minLength":1,"type":"string"}},"required":["source_class","source_ref","license","derivation"],"type":"object"},"rights":{"additionalProperties":false,"properties":{"admissible":{"const":true},"classification":{"const":"PROJECT_GENERATED_SYNTHETIC"},"reviewer":{"const":"PENDING_INDEPENDENT_REVIEW"}},"required":["classification","reviewer","admissible"],"type":"object"},"secret_scan":{"additionalProperties":false,"properties":{"allowlist":{"items":{"minLength":1,"type":"string"},"maxItems":0,"type":"array"},"findings":{"const":0},"ruleset_sha256":{"pattern":"^[0-9a-f]{64}$","type":"string"},"scanner":{"const":"EvidencePackageSecretScanV1"}},"required":["scanner","ruleset_sha256","findings","allowlist"],"type":"object"}},"required":["case_id","path_id","family_id","control_case_id","fixture_kind","artifacts","generator","provenance","rights","privacy","secret_scan","mutation_locality","contamination"],"type":"object"},"content_sha256":{"pattern":"^[0-9a-f]{64}$","type":"string"},"created_at_utc":{"minLength":1,"type":"string"},"producer":{"additionalProperties":false,"properties":{"actor_id":{"minLength":1,"type":"string"},"role":{"minLength":1,"type":"string"}},"required":["actor_id","role"],"type":"object"},"record_id":{"minLength":1,"type":"string"},"reviews":{"items":{"additionalProperties":false,"properties":{"decision":{"enum":["ADMIT","REJECT"]},"independent_from":{"items":{"minLength":1,"type":"string"},"type":"array"},"rationale":{"minLength":1,"type":"string"},"reviewed_at_utc":{"minLength":1,"type":"string"},"reviewed_content_sha256":{"pattern":"^[0-9a-f]{64}$","type":"string"},"reviewer_id":{"minLength":1,"type":"string"}},"required":["reviewer_id","independent_from","decision","reviewed_at_utc","reviewed_content_sha256","rationale"],"type":"object"},"type":"array"},"schema":{"const":"FixtureAdmissibilityV1"},"spec_sha256":{"pattern":"^[0-9a-f]{64}$","type":"string"},"supersedes":{"type":["string","null"]}},"required":["schema","record_id","spec_sha256","created_at_utc","producer","supersedes","body","content_sha256","reviews","admission_status"],"type":"object"}
