{"admission_status":"CANDIDATE","body":{"artifacts":[{"bytes":22723,"media_type":"application/json","ref":"fixtures/fx-07.json","sha256":"b5807991fe74c0b170a4ffa8f76766c2ab26a169ebc49d9a51b4bc4c21ad9e7f"}],"case_id":"P1-03","contamination":{"mutation_label_visible":false,"opaque_names":true,"oracle_fields_visible":false},"control_case_id":"P1-C","family_id":"P1-FAMILY","fixture_kind":"MUTATION","generator":{"config_sha256":"bc6b4fc20e3cd24c89b521dd83af70a0fc8809d9b947bf7a7d90bae825e968cd","repository":"MCPAudit","revision":"sha256:bc6b4fc20e3cd24c89b521dd83af70a0fc8809d9b947bf7a7d90bae825e968cd"},"mutation_locality":{"after_vector":[1,1,0,1,1,1],"axis":"MASKED","before_vector":[1,1,1,1,1,1],"changed_fields":["/receipt/repositories/code.example.invalid~1example-org~1project-alpha/providers/dependabot/alert_count","/snapshot/projects/0/security/providers/dependabot/alert_count"],"favourability_payload_unchanged":true,"parent_sha256":"31468a35093afd3811712cb41639e467d166aa122ac75e45782ec7644e0901eb"},"path_id":"P1","privacy":{"real_data_present":false,"reserved_identities_only":true,"synthetic_only":true},"provenance":{"derivation":"deterministic local generator; no live rows or private repository data","license":"CC0-1.0","source_class":"SYNTHETIC_FROM_FIRST_PRINCIPLES","source_ref":"urn:example:evidence-conservation:fx-07"},"rights":{"admissible":true,"classification":"PROJECT_GENERATED_SYNTHETIC","reviewer":"PENDING_INDEPENDENT_REVIEW"},"secret_scan":{"allowlist":[],"findings":0,"ruleset_sha256":"6d6cbdfc033af58b25340ed56da0ec605614268e0341f3e9f1b58de1c7116481","scanner":"EvidencePackageSecretScanV1"}},"content_sha256":"0af5c25e386437575c7eff65516ad885c5cd0503791ad83b9ac7d44c35d91de3","created_at_utc":"2026-07-31T16:20:00Z","producer":{"actor_id":"codex","role":"EVIDENCE_PACKAGE_GENERATOR"},"record_id":"fixture-admissibility-fx-07-v1","reviews":[],"schema":"FixtureAdmissibilityV1","spec_sha256":"711b5c32b053a0e471b9d7e8b0327160d205a8bdfa88f207a921909905afd188","supersedes":null}
