{"admission_status":"CANDIDATE","body":{"artifacts":[{"bytes":22723,"media_type":"application/json","ref":"fixtures/fx-06.json","sha256":"03dae1987f6bd13a24ccc6c395d149894d286ec98010cb53c89524636c0ecee8"}],"case_id":"P2-C","contamination":{"mutation_label_visible":false,"opaque_names":true,"oracle_fields_visible":false},"control_case_id":"P2-C","family_id":"P2-FAMILY","fixture_kind":"CONTROL","generator":{"config_sha256":"bc6b4fc20e3cd24c89b521dd83af70a0fc8809d9b947bf7a7d90bae825e968cd","repository":"MCPAudit","revision":"sha256:bc6b4fc20e3cd24c89b521dd83af70a0fc8809d9b947bf7a7d90bae825e968cd"},"mutation_locality":{"after_vector":[1,1,1,1,1,1],"axis":"CONTROL","before_vector":[1,1,1,1,1,1],"changed_fields":[],"favourability_payload_unchanged":true,"parent_sha256":"03dae1987f6bd13a24ccc6c395d149894d286ec98010cb53c89524636c0ecee8"},"path_id":"P2","privacy":{"real_data_present":false,"reserved_identities_only":true,"synthetic_only":true},"provenance":{"derivation":"deterministic local generator; no live rows or private repository data","license":"CC0-1.0","source_class":"SYNTHETIC_FROM_FIRST_PRINCIPLES","source_ref":"urn:example:evidence-conservation:fx-06"},"rights":{"admissible":true,"classification":"PROJECT_GENERATED_SYNTHETIC","reviewer":"PENDING_INDEPENDENT_REVIEW"},"secret_scan":{"allowlist":[],"findings":0,"ruleset_sha256":"6d6cbdfc033af58b25340ed56da0ec605614268e0341f3e9f1b58de1c7116481","scanner":"EvidencePackageSecretScanV1"}},"content_sha256":"0d1ba7f523a68d51435d2e284cddfc4c94a910f06c0ce2dc8868f61ce2080cca","created_at_utc":"2026-07-31T16:20:00Z","producer":{"actor_id":"codex","role":"EVIDENCE_PACKAGE_GENERATOR"},"record_id":"fixture-admissibility-fx-06-v1","reviews":[],"schema":"FixtureAdmissibilityV1","spec_sha256":"711b5c32b053a0e471b9d7e8b0327160d205a8bdfa88f207a921909905afd188","supersedes":null}
