{"admission_status":"CANDIDATE","body":{"artifacts":[{"bytes":22723,"media_type":"application/json","ref":"fixtures/fx-12.json","sha256":"6cb906500cc42e212847d71d011f94bd0a45e614a59db101ccf1d2555b4745ec"}],"case_id":"P3-06","contamination":{"mutation_label_visible":false,"opaque_names":true,"oracle_fields_visible":false},"control_case_id":"P3-C","family_id":"P3-FAMILY","fixture_kind":"MUTATION","generator":{"config_sha256":"bc6b4fc20e3cd24c89b521dd83af70a0fc8809d9b947bf7a7d90bae825e968cd","repository":"MCPAudit","revision":"sha256:bc6b4fc20e3cd24c89b521dd83af70a0fc8809d9b947bf7a7d90bae825e968cd"},"mutation_locality":{"after_vector":[1,1,1,1,1,0],"axis":"MISBOUND","before_vector":[1,1,1,1,1,1],"changed_fields":["/anchor/database_b64","/anchor/manifest/sha256","/anchor/manifest/source_fingerprint","/anchor/manifest/source_identity"],"favourability_payload_unchanged":true,"parent_sha256":"4b7f6419d06965bd837e6fcf83944edcba81211de498c07452201c2b4e67c39e"},"path_id":"P3","privacy":{"real_data_present":false,"reserved_identities_only":true,"synthetic_only":true},"provenance":{"derivation":"deterministic local generator; no live rows or private repository data","license":"CC0-1.0","source_class":"SYNTHETIC_FROM_FIRST_PRINCIPLES","source_ref":"urn:example:evidence-conservation:fx-12"},"rights":{"admissible":true,"classification":"PROJECT_GENERATED_SYNTHETIC","reviewer":"PENDING_INDEPENDENT_REVIEW"},"secret_scan":{"allowlist":[],"findings":0,"ruleset_sha256":"6d6cbdfc033af58b25340ed56da0ec605614268e0341f3e9f1b58de1c7116481","scanner":"EvidencePackageSecretScanV1"}},"content_sha256":"54bb7678c59a6f3c2d3fd2685320d5ea18701c8aab1bdb7618fb77132b8ab70e","created_at_utc":"2026-07-31T16:20:00Z","producer":{"actor_id":"codex","role":"EVIDENCE_PACKAGE_GENERATOR"},"record_id":"fixture-admissibility-fx-12-v1","reviews":[],"schema":"FixtureAdmissibilityV1","spec_sha256":"711b5c32b053a0e471b9d7e8b0327160d205a8bdfa88f207a921909905afd188","supersedes":null}
